{
  "$schema": "https://json-schema.org/draft/2020-12/schema",
  "$id": "https://onix.devtoolsdk.com/schemas/event.raw.schema.json",
  "title": "RawEvent",
  "description": "Evento crudo de telemetría. Lo publica onix-hook en onix.raw.<session> y lo consume onix-ingestor. No contiene análisis ni redacción de credenciales todavía.",
  "type": "object",
  "additionalProperties": false,
  "required": ["v", "session", "agent_role", "hook", "ts", "project"],
  "properties": {
    "v": {
      "type": "integer",
      "description": "Versión del contrato de evento. Permite evolucionar el formato sin romper consumidores.",
      "const": 1
    },
    "session": {
      "type": "string",
      "description": "claude_session_id: identifica la sesión-agente que originó el evento.",
      "minLength": 1
    },
    "agent_role": {
      "type": "string",
      "description": "Rol del agente que generó el evento (deriva de ONIX_AGENT_ROLE o de la skill activa).",
      "enum": ["project_lead", "fullstack", "designer", "growth", "sales", "gm"]
    },
    "hook": {
      "type": "string",
      "description": "Hook de Claude Code que disparó el evento.",
      "enum": ["SessionStart", "PreToolUse", "PostToolUse", "Stop", "SubagentStop", "Notification"]
    },
    "ts": {
      "type": "string",
      "format": "date-time",
      "description": "Momento del evento en el lado del agente (ISO-8601 UTC)."
    },
    "tool": {
      "type": "string",
      "description": "Nombre de la herramienta invocada (Bash, Read, Edit, WebSearch...). Ausente en hooks que no son de tool."
    },
    "params": {
      "type": "object",
      "description": "Parámetros crudos de la tool. PUEDE contener credenciales: onix-guard los redacta más adelante. Nunca se persiste tal cual.",
      "additionalProperties": true
    },
    "result": {
      "$ref": "#/$defs/Result"
    },
    "tokens": {
      "type": "integer",
      "description": "Tokens consumidos por la acción, si el hook los reporta.",
      "minimum": 0
    },
    "cost_usd": {
      "type": "number",
      "description": "Costo estimado en USD de la acción.",
      "minimum": 0
    },
    "cwd": {
      "type": "string",
      "description": "Directorio de trabajo del agente cuando ocurrió el evento."
    },
    "project": {
      "type": "string",
      "description": "Identificador del proyecto monitoreado (ONIX_PROJECT).",
      "minLength": 1
    },
    "stage": {
      "type": "integer",
      "description": "Número de etapa (1..12) en curso, si aplica.",
      "minimum": 1,
      "maximum": 12
    }
  },
  "$defs": {
    "Result": {
      "type": "object",
      "description": "Resultado de la ejecución de la tool.",
      "additionalProperties": false,
      "properties": {
        "exit_code": {
          "type": "integer",
          "description": "Código de salida (0 = éxito). exit_code != 0 marca error."
        },
        "duration_ms": {
          "type": "integer",
          "description": "Duración de la acción en milisegundos.",
          "minimum": 0
        }
      }
    }
  }
}
