{
  "v": 1,
  "session": "b3f1c2a0-9d4e-4f2a-8c1b-7e6d5a4b3c2d",
  "agent_role": "fullstack",
  "hook": "PostToolUse",
  "ts": "2026-09-27T14:41:05Z",
  "tool": "Bash",
  "params": { "command": "npm run test" },
  "result": { "exit_code": 1, "duration_ms": 4200 },
  "tokens": 860,
  "cost_usd": 0.0,
  "cwd": "/repo",
  "project": "onixguard",
  "stage": 3
}
